<!ELEMENT BookStore (book)+>
<!ELEMENT book (Title,Author,ISBN,Publisher,Edition,Price)>
<!ELEMENT Title (#PCDATA)>
<!ELEMENT Author (#PCDATA)>
<!ELEMENT ISBN (#PCDATA)>
<!ELEMENT Publisher (#PCDATA)>
<!ELEMENT Edition (#PCDATA)>
<!ELEMENT Price (#PCDATA)>